Referencia de contrato,Empleado,Fecha de inicio,Salario,Estado
Contrato de Corliss Karoly,Corliss Karoly,01/07/2021,3000,En proceso
Contrato de Roch Hagan,Roch Hagan,01/07/2021,5000,En proceso
Contrato de Kayne Tyrone,Kayne Tyrone,01/07/2021,5000,En proceso
Contrato de Lev Uwins,Lev Uwins,01/07/2021,7000,En proceso
Contrato de Ingemar Pagin,Ingemar Pagin,01/07/2021,7000,En proceso
Contrato de Kath Kanzler,Kath Kanzler,01/07/2021,5500,En proceso
Contrato de Hubie Amiss,Hubie Amiss,01/07/2021,5500,En proceso
Contrato de Karoly Chawkley,Karoly Chawkley,01/07/2021,9000,En proceso
Contrato de Helenelizabeth Grieve,Helenelizabeth Grieve,01/07/2021,15000,En proceso
Contrato de Pierette Gambie,Pierette Gambie,01/07/2021,5500,En proceso
Contrato de Saundra Giordano,Saundra Giordano,01/07/2021,5500,En proceso
Contrato de Gertie Moncey,Gertie Moncey,01/07/2021,17000,En proceso
Contrato de Micah Simonnot,Micah Simonnot,01/07/2021,14000,En proceso
Contrato de Kaine Naul,Kaine Naul,01/07/2021,17000,En proceso
Contrato de Clevey Keeney,Clevey Keeney,01/07/2021,5500,En proceso
Contrato de Barrie Ringwood,Barrie Ringwood,01/07/2021,9000,En proceso
Contrato de Roseanna Salla,Roseanna Salla,01/07/2021,9000,En proceso
Contrato de Marlane Ould,Marlane Ould,01/07/2021,9000,En proceso
Contrato de Jakie Geck,Jakie Geck,01/07/2021,5000,En proceso
Contrato de Fawn Pittle,Fawn Pittle,01/07/2021,14000,En proceso
Contrato de Kessia Knoller,Kessia Knoller,01/07/2021,3000,En proceso
Contrato de Nari Savary,Nari Savary,01/07/2021,5000,En proceso
Contrato de Barbee Hune,Barbee Hune,01/07/2021,5500,En proceso
Contrato de Seka Howkins,Seka Howkins,01/07/2021,7000,En proceso
Contrato de Kirbie Badini,Kirbie Badini,01/07/2021,5000,En proceso
Contrato de Arabella Parkin,Arabella Parkin,01/07/2021,5000,En proceso
Contrato de Bayard Butterly,Bayard Butterly,01/07/2021,5500,En proceso
Contrato de Orella Phillips,Orella Phillips,01/07/2021,5500,En proceso
Contrato de Dede Brodhead,Dede Brodhead,01/07/2021,5500,En proceso
Contrato de Paquito Eglin,Paquito Eglin,01/07/2021,7000,En proceso
Contrato de Shawn Ludwell,Shawn Ludwell,01/07/2021,5500,En proceso
Contrato de Noble Castagnet,Noble Castagnet,01/07/2021,9000,En proceso
Contrato de Gan Fraczak,Gan Fraczak,01/07/2021,3000,En proceso
Contrato de Elisabet Greenshiels,Elisabet Greenshiels,01/07/2021,15000,En proceso
Contrato de Sheffy Twinberrow,Sheffy Twinberrow,01/07/2021,5500,En proceso
Contrato de Katuscha Chivrall,Katuscha Chivrall,01/07/2021,7000,En proceso
Contrato de Merrile Pusey,Merrile Pusey,01/07/2021,3000,En proceso
Contrato de Ferdie Kapelhof,Ferdie Kapelhof,01/07/2021,9000,En proceso
Contrato de Barri Steuart,Barri Steuart,01/07/2021,14000,En proceso
Contrato de Saundra Silcock,Saundra Silcock,01/07/2021,6000,En proceso
Contrato de Garnet Comer,Garnet Comer,01/07/2021,15000,En proceso
Contrato de Xenia People,Xenia People,01/07/2021,5500,En proceso
Contrato de Crystie Glendzer,Crystie Glendzer,01/07/2021,9000,En proceso
Contrato de Miguel Possell,Miguel Possell,01/07/2021,5500,En proceso
Contrato de Miof mela Horley,Miof mela Horley,01/07/2021,14000,En proceso
Contrato de Leicester Pillinger,Leicester Pillinger,01/07/2021,17000,En proceso
Contrato de Lauree Ransfield,Lauree Ransfield,01/07/2021,5000,En proceso
Contrato de Yank Kirk,Yank Kirk,01/07/2021,5000,En proceso
Contrato de Iolande Quemby,Iolande Quemby,01/07/2021,5500,En proceso
Contrato de Shelby Haycock,Shelby Haycock,01/07/2021,15000,En proceso
